question,answer
disability insurance required law ,generally  five state require employer carry short term disability insurance employee  state  california  hawaii  new jersey  new york  rhode island  besides mandatory short term disability law  legislative imperative someone purchase covered disability insurance 
creditor take life insurance death ,person passed away one debt  creditor generally take life insurance proceeds left long beneficiary person  money belongs beneficiary  long creditor claim beneficiary  take life insurance proceeds 
traveler insurance renter insurance ,one insurance carrier represent traveler yes  purchase renter insurance traveler  would look local agent assist placing renter policy interested  sure local agent would happy quote traveler access carry well 
drive new car home without insurance ,auto dealer let drive car lot unless proof insurance loan car  never good idea drive car without insurance  traded car  coverage older car may extend new car temporarily  need call agent soon possible get changed  dealership insurance agent work get coverage well 
cash surrender value life insurance taxable ,cash surrender value come whole life insurance  never term  amount terminate policy receive  amount includes put profit made  profit taxable  profit would taxable  far better idea would surrender whole life policy  instead keep borrow either repay choose repay wish  continue grow value  even loan  policy stay force  although death benefit reduced loan paid back  numerous option discus qualified agent  gary lane  registered representative  new york life  949 797 2424 call anytime  thank 
annuity income reported ,good news annuity income usually reported insurance company issuing annuity  make disbursement also issue appropriate documentation assist filing tax  send identical information internal revenue service  generally speaking money withdrawn annuity treated interest taxed ordinary income interest exhausted basis  sum premium paid  remains  money recovered free income tax  annuity annuitized  paid monthly installment either extended period time lifetime annuitant  exclusion factor determined applied payment  part payment taxed ordinary income  bad news principle apply nonqualified annuity held individual barely touch situation arise taxation unique situation  response meant take place legal accounting professional advice alert complexity taxing annuity  obvious situation annuity held asset qualified pension plan  includes defined benefit plan  defined contribution plan  401  k   ira many others  income taken plan taxed ordinary income unless taken prior age fiftynine half  taken earlier could subject penalty tax additional ten per cent  annuity taxation becomes complex deferred annuity transferred  person give another person annuity life  life third party  basic rule transfer treated surrender taxed accordingly  annuity transferred treated fully paid  basis value taxed  estate planning reason ownership annuity sometimes held trust lead another set taxation consideration involving nonnatural person rule  going taxed basic issue quite tangled  course exception rule  taxation fairly straightforward annuity annuitized  state law concerning probate create unexpected outcome taxation  individual owns annuity annuitant another person  perhaps spouse  death owner trigger beneficiary provision another third person could suddenly contract upsetting intention couple  even child  many taxation rule specific individual insurance company wise carefully make sure company select purchase annuity follows procedure maintain plan keep taxation uncomplicated possible  absent plan  irs frequently call liquidation transferred annuity within five year  key desire get tax question settled 
aaa home insurance cover ,aaa home insurance  like major carrier  cover wide variety claim  including fire  theft  vandalism  many item  however  numerous type policy offered  best determine type policy accurately understand benefit  experienced broker help 
simple retirement plan ,simple retirement plan  simple inexpensive opportunity small business retirement plan nt break bank advisor fee  simple plan irs approved plan step follow expensive testing record keeping nt necessary  small business considering retirement plan offer  right top provide great platform business would rather use s money put towards employee retirement rather third party administers plan 
social security disability insurance cover ,social security disability insurance pay monthly benefit people work due disability  benefit paid cash recipient use wish  paid institution entity  injury illness cause person unable work covered 
car insurance prepaid ,yes  automobile insurance typically paid advance  normally le thirty day time  carrier set requirement initial payment amount new coverage  carrier allow client pay monthly  quarterly  semiannually  annually  pay premium full semiannual annual may also receive discount rate  solely discretion carrier  
medicare part b cover ,medicare part b cover doctor service  outpatient hospital service  medical service supply  monthly cost charged social security check received  deductible 20  copayments incurred  addition pay cost service supply covered medicare 
veteran get life insurance ,unless service person get veteran group life insurance  vgli  within year separating service  servicemembers group life insurance  sgli  end need get private policy  contact agency website carry several product choose find best rate veteran s life insurance 
homeowner insurance cover lost wedding ring ,great question  generally  homeowner  policy cover anything lost  referred  mysterious disappearance  policy document usually listed specific exclusion  said  certainly obtain coverage loss working insurance professional asking item insured specifically either rider attached homeowner  policy stand alone separate policy  need provide current appraisal item would insured stated amount appraisal  rider separate policy  commonly referred  personal inland marine   include much broader coverage standard homeowner policy cover loss 
assigned risk auto insurance work ,assigned risk california amfamiliarwith processing center people trouble buying auto insurance connected insurance company insure  assigned risk insurance company company required law participate  amount auto insurance company road would constitute percentage obligation plan  financial hardship criterion qualify assigned risk  also agent offer assigned risk must becertifiedto offer coverage  go online beconnectedto agent see qualify assigned risk 
boyfriend add car insurance ,living household put list driver  insurance follows car linked household  person buying insurance household loan car whoever wish  insurance cover automobile  living together wouldnt anything gained putting policy 
need police report submit claim car accident private property ,actually  though local police might prepare accident report  many case  incident occured private property  likely would take action  therefore  possible  becomes important exchange information party involved  would also recommend neither car moved take photo record insurance company help processing claim 
full coverage auto insurance cover repair , full coverage  assuming mean  carrying comprehensive collision coverage cover repair  covered claim ie  an accident  hit deer  backed wife s car like week  yes  carrying comprehensive collision coverage would pay fix covered damage subject poilcy deductible  experiencing general vehicle issue  ie   motor running roof  transmission mission general wear tear   insurance coverage would come play case  insurance come play repair vehilce covered claim 
life insurance acceptable islam ,use interest chance believe insurance permitted islam  ie  haram sinful   due spiritual nature question  seek advice imam guidance islam s position insurance 
health insurance cover tubal reversal ,insurance plan cover reversal voluntary sterilization treatment designed overcome infertility  fifteen state insurance mandate requiring form coverage infertility  every one mandate specifically excludes covering reversal surgery  best alternative take advantage tax deductible expense  buy extra coverage resulting pregnancy  lower deductible health insurance  short term disability  hospital indemnity 
much life insurance get diagnosed breast cancer ,traditionally  get 2030x income level life insurance  medical history necessarily limit much get  medical history determines risk classification control premium coverage want put place  come breast cancer  detail medical condition determine carrier offer coverage risk classification would  carrier different underwriting  may get risk class offer   best thing shop case via independent insurance agentbroker shop multiple company  want apply multiple company work due mib  medical information bureau   company s point view  s sort like red flag saw applied multiple company check mib  order secure accurate quote coverage  number factor would need known cancer diagnosed  stage inwas  treated  treatment completed  anymore test scheduled need completed  treated condition  prescription take  family medical history  factor  copy pathology report  help lot input  cancer current  guaranteedissue whole life  giwl  type coverage available nt medical question exam requirement  however  amount coverage available single policy  20000  25000  depending carrier  get  would need stack multiple policy  giwl policy  traditionally feature 2 3 year graded period  meaning accidental death coverage period  otherwise carrier return premium paid policy death occurs graded period  graded period expires  full benefit payable  carrier typically issue fullyunderwritten coverage cancer remissiontreatment completed least 2 year  many carrier prefer 5 year date treatment completed favorable risk class  send message via  contact  button profile picture would like assist coverage  group licensed 50 different carrier numerous state  hope information helpful  please let know assistance  thanks much 
need register medicare ,paid tax system enrollment automatic  receive medicare card packet information medicare shortly turn 65 qualify medicare disability  receive card time turn 65 need call social security office 1800medicare 
short term disability insurance work ,shortterm disability work qualifying disability  applying short longterm disability  need look definition disability occupation  company definition  definition vague  may find denied claim receiving  lesser  amount applied 
homeowner insurance cover pool ,short  answer yes  need clarified whether asking property damage pool liability coverage  would covered barring specific pool exclusion  aware standard market  someone get injured swimming pool  yes  homeowner policy cover liability  likewise  pool damaged due standard homeowner cause loss le standard exclusion pool would covered property damage pool  keep mind wear tear would covered policy  pool liner rip   concrete foundation crack  would considered wear tear  please note many insurance carrier cautious writing homeowner insurance home pool  like write pool exposure  mind  sure ask agent might affect current coverage future coverage premium impact might  also want strongly consider higher liability limit purchasing umbrella already umbrella policy higher umbrella limit  might cost  150 additional  1 mil limit  lastly  pool want make sure covered proper limit  make sure coverage b  structure  limit sufficient cover loss pool structure ie  detached garage  shed well 
sign medicare ,sign medicare three month month 65th birthday  month 65th birthday  three month following month 65th birthday  miss enrollment period sign jan 1 march 31 year 
mip affect car insurance ,great question  minor question possession charge  better bet  minor someone car   might get lucky insurance company wo nt find  fact allowing breaking law  suggests decision making skill need work  result  point yes  affect policy  likely filing claim  please consider serious wake call  many teenager die result drunk driving  nt  neither anyone else road  need another sad statistic  seriously  stop  thanks asking 
blue cross blue shield life insurance ,blue cross  blue shield name network association number health insurance company  includes anthem carefirst   many health insurance company also offer life insurance program  however  s typically type coverage specialize product may therefore competitive insurance company feature life insurance program main type insurance offer  insurance company specializing life insurance tend aggressive underwriting offer lower rate want secure type business others  please let know assistance  thanks much 
advantage disadvantage long term care insurance ,advantage coverage senior year significant based average senior couple spending  250000 medical cost retirement year  disadvantage loss economic opportunity invest save premium dollar spent long term care insurance never use 
medicare pay life alert ,medicare cover item considered medically necessary  includes diagnosis treatment medical condition caused accident illness  medicare also cover dme  durable medical equipment  prescribed doctor part treatment plan  service life alert considered medically necessary 
life insurance buy ,product suitability always consideration considering product line diverse application  life insurance generally purchased indemnification inheritance planning  used supplemental retirement income  term life insurance excellent temporary coverage temporary financial exposure beneficiary  permanent liability  many planner use guaranteed universal life insurance  supplemental retirement income several crediting method  interest rate crediting use participating whole life current assumption universal life  desire access domestic andor foreign index  review indexed universal life insurance  risk tolerance permit  could consider variable universal life access separate sub account use marker equity bond instrument 
medicare pay hpv screening ,medicare cover annual exam including woman s gynocological exam testing  part pelvic exam pap test  doctor screen abnormality including std s  abnormal cell hpv  hpv virus linked certain type cervical cancer  regular hpv screening normally covered medicare
best life insurance get ,best life insurance get going depend many factor  prominent one taking policy  otherwise  would say whole life policy one provide lot bang buck case  ensure get policy right contact local agent discus need expectation direct policy best fit 
much long term care insurance cost ,long term care insurance premium vary greatly according age  health  feature policy  area policy purchased  however  could look federal guideline much premium exempted income tax return  get general guide life insurance premium  2013   40   360single   720couple 4150   680single   1360couple 5160   1360single   2720couple 6170   3640single   7280couple 71   4550single   9100couple
safe fixed annuity ,tax deferred  fixed annuity based contractual claim annuity policy  contractual claim annuity policy good financial strength claim paying annuity company issued policy  generally  fixed interest rate annuity guarantee rate period time like 5  7 10 year  annuity insurance company portfolio generally dominated government bond 
long take settle life insurance claim ,life insurance death claim generally filed beneficiary policy  beneficiary contact insurance company death claim form return obituary certificate death  process take 30 60 day  death occurred within two year contestability period  standard investigation ensue delay payment 
car insurance credit checked ,applying auto insurance coverage insurance carrier called soft pull insured s credit score  soft pull normally adversely affect person credit rating  credit score one part many factor taken consideration rate calculated 
use hsa pay long term care insurance ,yes  use hsa pay long term care insurance premium  limit premium ltc insurance paid health saving account  instruction section  form 1040  tax return tell limit premium deducted age group year 
employer charge smoker health insurance ,yes  application premium surcharge tobacco user become common recent year  primarily larger group selffund employee benefit plan employer much control benefit plan design rate structure fully insured plan  affordable care act  aca   away preexisting condition exclusion  explicitly allow adjustment rate tobacco use   sense  tobacco user class employee legal discriminate penalize personal behavior  aca silent consumption marijuana may present interesting situation state move allow use medical marijuana legalize recreational use 
home owner insurance usually cover ,s kind tough question answer becuase many homeowner policy cover multitude thing  general term house catch fire  broken  damaged wind hail lightning  pipe burst  body trip fall proprty get hurt could claim situation homeowner policy  scratching surface every policy different every state  carrier add bunch  extra  coverage  truly know homeowner policy cover  need two thing 1  call local independent agent discus policy 2  actually read policy  know reading legal contract idea fun night curled fire  best interest actually read entire policy  know includes excludes ask agent thing question 
much ultrasound cost without health insurance ,ultrasound exam usually hundred dollar health insurance  health care blue book show price  158 abdominal ultrasound including physician fee  ultrasound body part may le  ask doctor cost advance negotiate acceptable rate 
10 yr term life insurance ,great question  ten year term policy one provides specified amount coverage ten year defined policy  day policy expires  coverage  cash value benefit take  renew policy  dramatically increase price  typically policy like insure short term loss  like covering college career  mortgage  provide cheaper form life insurance money tight  would like detail  please feel free contact  okay  thanks asking 
put money 401k roth ira ,excellent question    excellent strategy maximize much afford amount contribute retirement fund  contribute much 401 earn employer match  s free money  way  take advantage  roth allow  5500 year   6500 50  401  contribute much possible  earlier start  better  maximizing contribution  help balance time come money little tighter  ca nt contribute much  thank asking 
get health insurance hepatitis c ,purchase health insurance hepatitis c preexisting medical condition  would waiting period benefit begin  time quickly running  affordable care act requires health plan accept applicant regardless existing medical condition  applicant need enroll plan annual open enrollment period state insurance exchange  first open enrollment end march 31 2014  day  coverage would begin april 1 miss open enrollment window could enroll plan january 1  2015 effective date 
enroll medicare part ,automatically enrolled medicare reach age 65 provided worked long enough paid system  choice opt part b medicare  recommend unless still working group  also get medicare social security disability  two year wait get disability eligible 
health insurance originate ,great question  type traveler insurance offered 1840 s covered train crashed steamboat sank   really nt much late 1800 s disability policy became popular  britain passed law early 1900 s created  national health insurance   europe kind adopted similar law  nt catch 1929 u texan  baylor university hospital  local teacher  think  created system standardized cost hospital stay  shortly thereafter came blue crossblue shield  kind competing company  history insurance interesting stuff  thanks asking 
important health care insurance ,important  health insurance allows people go get health care needed  typically people insurance get check ups  find problem sooner due early detection address health need proactively  nt health insurance spend day praying never get sick  possible strive keep health insurance family 
much cost get renter insurance ,great question  often client afraid ask think believe expensive actually relatively inexpensive  typically insure two vehicle company discount gain second policy auto insurance cover cost renter policy close  average cost 60120 dollar year  ten dollar le coverage phone  computer  book  clothes  medication  cd s  movie  art  gun whatever else  ten dollar month inexpensive  also covered anywhere world 
home insurance cover theft ,important talk insurance professional specific term condition policy  generally speaking  theft named covered peril home insurance policy  would include theft personal property within home course  also includes theft property outside home  personal property outside home usually covered 10  total personal property amount listed policy  covered  loss settlement would subject deductible  claim specialist also looking copy police report 
renter insurance benefit landlord ,great question  landlord need provide safe environment tenant  carry insurance property  help protect property managercomplex higher liability  renter policy help take liability shoulder  damage apartment  someone injured apartment  policy cover claim  landlord  thanks asking 
ohio employer offer health insurance ,employer ohio required offer health insurance worker although avoid penalty family afford healthcare benefit offered  also  penalty delayed 2015 give employer insurer time work specific detail implementation  tax penalty applies company 50 worker applies worker dependent  including child age 26 technically  law apply spouse   fulltime  would considered working 30 hour per week  however  100 parttime worker working 20 hour per week would qualify 50 fulltime worker  ohio  enjoyed low health insurance rate  although required mandate raising premium  still many lowcost optionsmost major insurer  including anthem medical mutual  participating state health exchange 
much auto insurance ,always recommend highest limit liability afford  good insurance score  clean driving record  premium difference 50100  50k per person100k per accident  100300 much relatively speaking  also  good idea high limit liability property damage   100000  national average vehicle liability award 2008  326628  said  always recommend least 250500 limit liability  additionally  always recommend  umbrella policy  increase limit liability  ask insurance agent quote  1000000 umbrella policy  sure tell agent property vehicle titled 
homeowner insurance increase ,homeowner insurance contract whereby homeowner transfer hisher risk insurance carrier return contract small premium  homeowner insurance premium usually increase year year  however  chance decrease may seen  insurance company increase dwelling coverage year keep increasing cost reconstruction   homeowner insurance s primary purpose rebuild home unfortunate event total loss  small increase dwelling coverage year usually purpose draw attention premium rise  however  insignificant  insurance company audited year obligated comply state department insurance regulation every state underwrite risk  year  insurance carrier calculate necessary premium maintain safe financial condition offer security home insured  largest reason premium increase would loss experience  prior year  another reason may due increased operational cost including definitely limited reinsurance premium paid  insurance company either internal actuarial department hire independent actuarial firm charged responsibility calculating premium based underwriting factor prior loss data  reason  carrier offer annual policy unable predict risk longer term basis  since carrier experience different loss result every year  insurance rate increase percentage never one year next  since paid loss continue grow  claim frequency showing growth litigation becoming commonplace  insurance company raise premium keep outflow payment  important recognize claim operational expense paid pool collected policy premium  detailed explanation financial report current carrier  contact carrier representative receive report  also  data available published department insurance state 
buy medicare ,great question  vast majority people get medicare turning 65 program allow people age 65 enroll certain condition  like kidney failure  disability designated amount time  program designed help senior citizen afford health care  unless meet exception  need 65 older enroll  thanks asking 
remove medicare part b ,  medicare make difficult cancel  withdraw  medicare part b medicare part b provides important coverage people 65 older  s penalty someone cancel medicare later want enroll  medicare enrolls everyone automatically age 65 want make sure one cancel coverage without fully understanding consequence 
age get long term care insurance ,best time secure long term care insurance youre young healthy  especially family history chronic illness nursing home confinement  adviser begin addressing long term care insurance client prospect around age 50 reality  pre retiree purchase long term care insurance early 60 
life insurance death benefit taxable ,typically  life insurance proceeds taxable  pas beneficiary taxfree deposited preapproved prediscussed account  based 32 year experience handling many claim  period time 1030 day check arrive  circumstance  could estate tax  also  depending type policy premium paid  could taxable event  fulltime broker financial planner best resource 
medicare saving program ,medicare saving account  msa  specific type medicare advantage plan may may available area  similar hsa  health saving account  major medical plan  msa combine high deductible advantage plan tax favored saving account  everyone definite advantage 
