question,answer
eligible disability insurance ,take care 6 kid le homeowner insurance company let endorse day care coverage policy  however limited coverage  otherwise would need purchase day care insurance run average area northern california 100000 annual  generally would need work independent agent find right coverage 
need whole life insurance ,policy obtained legally  ie  applicant lie omit fact past drug use  result suicide first two year policy  life insurance policy likely pay death due drug overdose 
part medicare free ,eligible disability insurance  di   must health meet company s underwriting guideline policy  harder qualify medically disability insurance life insurance  many health condition cause disability cause death  good disability insurance broker guide right policy  must also income order eligible disability insurance  homemaker others receive steady income  unfortunately  ineligible coverage  occupation disqualify  said  people get disability insurance important part secure financial portfolio  good disability insurance agent immense help determining whether eligible affordable di coverage 
medicare va benefit ,anyone need life insurance last death age need whole life insurance universal life insurance lapse guarantee  without  policy might end needed  possibility getting new life insurance policy might exist  ie  want life insurance cover final expense  pas estate someone else  permanent policy needed 
need change car insurance move ,free  generally nt cost much  plan vary state plan cover different prescription different way  always recommend  go websitelink  choose  drug coverage  part   tab  choose  find health drug plan   site run medicare input prescription show plan available overall pocket cost  including premium  deductible  copays plan available  even specify pharmacy want work make sure accept plan choose  take couple generic drug plan might cost  15   25 per month  expensive drug might want spend premium save overall pocket cost 
choose right retirement plan ,yes  medicare va benefit  one plan secondary payer  since veteran administration benefit must used va facility  usually medicare secondary va insurance  however  sometimes va drug benefit good supplemental plan medicare  thus becomes secondary payer 
home insurance cover stolen cash ,still reside within state  need change car insurance  need inform local agent carrier new address  rate may change depending carrier rate area resided area moved  move outside state currently coverage established may seek new carrier 
face value life insurance ,first consideration whether plan qualified nonqualified  tax bracket high andor employer match contribution  qualified plan considered  tax bracket low employment nt offer match nonqualified plan considered  establish whether plan qualified nonqualified  funding retirement proper product next  need establish personal financial profile includes risk tolerance assessment  financial goal life expectancy review 
best medigap plan ,yes  policy limit  need check policy form look cash coverage  usually  1500  may vary different insurance company  talk insurance agent explain circumstance coverage cash taken 
minor beneficiary life insurance ,face value life insurance original amount coverage purchased  term insurance  usually paid death insured  permanent insurance  death benefit may higher lower original face value  due loan taken policy  due earnings within policy caused death benefit grow 
michigan require auto insurance ,medigap plan standardized  11 option total  meaning benefit exactly  regardless carrier purchase  several major thing look shopping medigap plan plan benefit  eg  plan f  plan g  plan n  etc    premium  premium rating method  community rated  attainedage rated  issueage rated   want coverage creates predictable expense structure throughout year  want look plan f plan g re willing take larger share risk expense keep premium  may want consider plan hif  plan n company use attainedage rated  rate based current age  system omaha  anthem  carefirst  cigna  humana  many others  united healthcare us communityrated  rate based age   carrier use issueage rated  rate based age plan first purchased  well everence 
sign cobra health insurance ,yes  minor beneficiary life insurance  however  reach age legally considered old enough manage money  either age 18 age 20  depending state live   someone else need named manage money  1  someone specify  people even name two guardian  one take care money  guardian estate  one take care child  guardian person   2  create trust beneficiary policy  trust spelling want money used minor s behalf  3  guardian specified trust created  court may appoint guardian time death policy proceeds collected  may want visit lawyer life insurance agent sure policy set way want  tragedy happen 
401  k  plan provide adequate retirement resource ,michigan  like state  requires driver carry specified minimum amount auto insurance coverage  minimum limit  20000 per person   40000 per accident additional  10000 property damage  however  limit quite low possible  within budget  consider higher limit  experienced broker  highlyrecommend next level coverage  provide much broader protection  free online quote always available toprated carrier 
military pension qualified retirement plan ,employer notify cobra right within 30 day group health insurance plan terminates  60 day exercise cobra right plus additional 45 day premium must paid  premium election retroactive first day cobra benefit 
take sell annuity ,401  k  retirement plan defined contribution plan funded various saving investment product  adequacy 401  k  based performance product contribution  based current trend  great risk retirement human longevity  odds 401  k  adequate fund retirement somewhat slim 
everyone 65 older qualify medicare ,military pension system doesnt meet standard definition  isnt established way pension plan established  isnt funded way either  closely resembles deferred compensation  taxed like deferred compensation well 
get long term care insurance 80 ,selling annuity take solid understanding taxation since key feature annuity tax deferral  tax deferred annuity also use three basic crediting method ll need learn  fixed interest rate crediting  indexed crediting separate sub account crediting  debiting   decide offer full array tax deferred annuity ll need secure life insurance license state department insurance series 6 7 series 63 state offered brokerdealer via finra 
much new york life insurance agent make ,almost everyone age 65 older qualifies medicare  u citizen legal resident least 10 year earned wage social security system qualify medicare  must lived u least 5 year may also qualify based spouse s time social security
sole proprietor deduct disability insurance premium ,although possible consider early 80  rate table may still exist  insurer effectively stopped issuing age  keep premium low  insurer marketing younger age increase business volume younger age  especially important time long term investment yield insurer fallen extreme level 
employer charge higher rate older employee ,much new york life agent make  well go zero million  depending agent  new york life commission based company pay agent completed transaction insurance equity investment  since company based new york commission payment based state new york s restriction commission  many case mean new york life agent make le upfront sale agent  commission payment tend stretched time policy 
homeowner insurance cover leaking basement ,yes sole proprietor deduct disability insurance premium income income tax purpose  choose  s important keep mind benefit paid policy claim received taxable income need pay income tax benefit received  instead choose deduct premium  benefit received income tax free 
notify medicare death ,employer discriminate employee based upon age  among multitude factor   however  necessarily mean older employee compare contributing towards employer based health insurance younger coworker coverage level find paying amount  may initially perceived older employee though discriminated almost certainly case  employer s group health insurance rate age based rate different rate year age covered employee  community rating requirement obamacare pushed many health insurance carrier towards age rated basis though health insurance carrier still develop  composite  rate group quoting age rated basis  composite rate one rate every employee employee  employeespouse  employeechild  ren  family coverage regardless employee s age   thing work community rating  first  3 1 ratio rate youngest oldest employee group  keep thing simple let s say monthly rate 25 year old  200 per month monthly rate 60 year old would  600 per month  let s say employer pay 50  employee rate leaf 50  employee pay  scenario 25 year old s cost would  100 per month   200 x 50   60 year old s share would  300 per month   600 x 50    even though dollar amount paid employee differs significantly employer treating employer contributing percentage amount towards employee s coverage  therefore  discrimination  one effect obamacare increasingly seen employee old health insurance plan rate structure replaced obamacare compliant plan new community rating method 
difference medicare advantage medigap insurance ,rain water hit ground considered peril  flood   water find way basement considered  seepage  excluded homeowner insurance policy  company consider coverage  water backup sewer drain  coverage however pushing limit  come company adjuster decide coverage 
much health insurance newborn cost ,medicare notified death soon possible  medicare request certified death certificate part process  assuming medicare supplement plan  carrier also notified death  medicare medigap carrier notified time stop next payment  ask refund 
auto insurance settlement taxable ,bit confusing  medigap plan utilized person covered traditional medicare  purchase policy insurance company blue cross  humana unitedhealthcare  although plenty insurer choose   medicare advantage private health plan offered alternative moretraditional medicare coverage  often hmo ppo  may see additional benefit included  independent broker andor reputable website great place view option multiple company  often instantly compare plan easily apply online 
renter insurance cover stolen cash ,notifying carrier often critical  deadline missed  possible next opportunity add newborn may many month away  possibly open enrollment period  state   shortterm  plan purchased  although premium inexpensive  benefit subject deductible preexisting condition covered  type policy considered option provided previous question exhausted 
need health insurance company ,yes  settlement amount cover vehicle repair even replacementand amount cover medical expense resulting accident taxable  ifyou compensated beyound medical expense vehicle repair replacement  lost wage  etc  amount may taxable  tax law change year year  consult local tax advisor know would taxable set circumstance 
much car insurance carry ohio ,standard renter policy offer minimal coverage stolen cash   may zero coverage much  200  300 depending insurance company policy  would surprising coverage without specifically requesting higher limit via endorsement policy  read policy coverage form insured property definition see specifically 
long short term disability insurance last ,great question  m sure nt one wonder  sad truth though  cost research development  advertising marketing  protection litigation  health product considerably expensive need  service  salary overhead contribute cost also  could afford medical emergency without health insurance  guess  60  bankruptcy result medical emergency  s great reason  thanks asking 
medicare retire ,ohio state minimum go  25000  50000 december 22nd 2013 improvement  minimum coverage  minimum  work agent explain coverage provide guideline coverage based specific financial situation 
brother drive car without insurance ,short term disability last long continually unable work due covered medical condition  policy benefit period met  whichever le  every policy different  make decision length benefit period purchase policy  policy longer benefit period cost shorter benefit period  may able choose length 3  6  12  24 month 
get medicare age 65 ,answer probably  yes   medicare  big fail   working taxpayer paid medicare payroll tax year expect medicare retire  medicare survive  nt expect anything like current plan  pay tax working  higher premium  deductible pocket covered medicare 
health insurance exist ,brother live heoccasionallydrivers car  would covered inmoststates  however  brother move life household  moststates insurer require listed policy additional driver  course  car insured  much easier 
difference medicare medicare b ,get medicare age 65 unless social security disability lou gehrig s disease  receiving social security disability benefit 24 month  worked long enough federal  state local government job meet requirement social security disability program  disabled widow widower  divorced disabled person  may able get medicare age 65 condition 
best time buy annuity ,health insurance came help pay catastrophic  large  medical claim  initially health insurance plan covered inpatient hospital stay  time medical care could handled inpatient became available outpatient basis  also  new prescription drug developed treat illness earlier considered incurable  new  quite expensive  drug came market health insurance expanded cover outpatient service including rx  extensive diagnostic testing mri ct scan outpatient surgery 
life insurance blood urine test ,medicare part hospital coverage  per benefit period  per admission  deductible  1184  2013  medicare pay portion  medicare part b doctor outpatient coverage  part b annual deductible  147  2013  medicare pay 80  approved amount  responsible balance 
happens life insurance divorce ,three basic tax deferred annuity crediting method  interest rate crediting  indice crediting separate account using equity bond investment  determine risk tolerance  time horizon distribution  prepare purchase one type annuity income retirement 
buy good life insurance ,great question  may also look thing  rule look thing  sugar level  diabetes  cholesteroltriglycerides heart diseasestroke risk  drug  alcohol tobacco use  illegal legal drug   chemical show kidney health liver health  protein show cancer risk  hiv hepatitis  thing help validate truthfulness answer  ass risk insuring  great question  thanks asking 
much basic renter insurance cost ,depend divorce structured  insurance agent attorney wo nt attempt tell law say regarding divorce  offer suggestion could happen  1  nothing  present insurance force prior divorce change divorce 2  judge assigns insurance policy  judge could order beneficiary policy changed support divorcing spouse child  could also issue instruction cash value policy distributed  would consult attorney detailed answer 
northwestern mutual whole life insurance good investment ,think  good  term life insurance product issued solid company lowest price possible  reputation financial soundness company discussed  price  pay 50  le amount term insurance one arated insurer another  mean get good value life insurance  comparison shop  many life insurance website offer quoting feature compare policy available insurer  dozen insurer   obviously  choice  better odds get lowest price insurance looking 
get cash term life insurance policy ,basic relative term could many thing many people  area  carrier work  seen ten thousand dollar base renter policy around eight dollar per month  please remember every carrier set standard base coverage determines s pricing model coverage offer  contact local agent area determine coverage offered area pricing coverage 
get cheap renter insurance ,northwestern mutual whole life good investment  well depends need  need make choice good bad investment  first northwestern mutual highly rated fiscally strong company  many others  using whole life investment work part overall investment strategy provides safe place accumulate money well protecting plan  find whole life insurance boring investment product  s exciting  s racy  s product  slow safe secure place put money  s boring say  owned whole life almost 30 year never let  ca nt say real estate stock market investment window time  oh  last thing keep short  whole life cash value nt go backwards  ca nt lose s 
much health insurance 60 year old ,unfortunately  term life insurance cash value build  therefore money cash  think term life insurance renting life insurance permanent life insurance buying life insurance  cash value plan policy whole life universal life insurance  expensive premium build cash value time need money 
much portfolio annuity ,find stripped renter insurance policy little  5000 per year local agent good credit  people spend  15000 per year renter insurance find value optional endorsement  personal property replacement cost  allows buy new item without deduction depreciation claim   customer add identity theft insurance policy file claim victim identity theft  help restore incorrect info pay attorney fee time work  short  basic policy wo nt cost much  extra dollar per month get much better coverage  state  may able help  send email 
get insurance without car ,average cost country health insurance plan  overall  estimated  328 per month  however  reflective upon silver level plan  2014 state figure average available yet  while try come  average  cost  s many factor go premium pricing say relation compare individual compared overall group  short   average  premium rather useless figure individual  s representative large group  could people paying small nominal amount  factoring subsidy  per month several thousand dollar per month  even s ton information sift get accurate representation  affordable care act  option bronze  silver  gold  platinum level plan  go metal  price go  provides better benefit   area also catastrophic plan available  addition  age zip code big factor well  younger  cheaper premium  older  higher premium  also  use tobacco product  premium increased 50  well  always recommend consulting experienced broker regarding personal health coverage  work look wide range option many top carrier industry find plan s going best suitable need  please let know assistance  thanks much 
renter insurance required ,tax deferred annuity ultimately purchased retirement income  whether qualified plan  new trend among adviser foundational income stream generate cash flow life annuitant matter long live  portfolio percentage differ  rule thumb 25 33  
save money homeowner insurance ,many folk company vehicle transportation provided  exposure different still driving car truck   need coverage  nt confused fact company owns vehicle  typically employer liability insurance   liability generally something might excess coverage  however unusual need coverage medical payment uninsured motorist  especially large employer might think employer heavy protection employee  may true liability ask employer uninsured insured motorist coverage way approach securing non owned coverage way would recommend obtain insurance need  call visit agent line ask quote  live az  ca  ga  mo tx would glad assist 
life tpd insurance ,insurance agent would say yes required  consumer pint view see would want extra expense  policy average 10 15 month lower car insurance much month many carrier bundle  little paying event loss would glad coverage  renter policy paying many thing liability someone get hurt apartment fire stay another place till could move back would cover living expense  also cover replace thing like clothes furniture much  many home owner renting home carrier require renting home renter get renter insurance  benefit 
buy life insurance people ,expensive mistake homeowner make underinsured  regardless premium  single high value loss exceeds limit policy make saving immaterial  setting adequate limit absolutely crucial  person help set appropriate limit reliable insurance agent  far greater problem many think  primary place show inadequate liability limit  homeowner policy provides liability coverage personal injury property damage law suit  company pay cost lawsuit limit policy  homeowner facing lawsuit alone  company offer adequate liability limit policyholder select limit lower maximum offered company  umbrella policy necessary homeowner  second area often underinsured valuable collection  homeowner policy internal limit recovery certain item  homeowner dont know inherited sterling silver woefully underinsured  dont understand gun cabinet could destroyed would get fraction value  true jewelry  coin collection  many item  detailed inside policy  homeowner ever read policy  people continue underinsure structure  common increasing phenomenon  homeowner improve home never inform company agent  event loss amount coverage might return home updated glory  coverage really inexpensive  however loss paralyzing  homeowner multiple home  second home often hazardous area  lakefront  beach front mountain property  cost replacing one home exceed insured value inflated reconstruction cost  forest fire sweep summer cottage  great demand contractor work also bidding material  get ugly  adequate insurance first step  second step focus policy  homeowner often save significant money increasing deductible policy  deductible set amount loss could absorbed without serious disruption family finance  often deductible policy  company traditionally offer discount coverage packaged  company cover wide range policy bringing single carrier premium saving often realized  particularly true another residence lease someone else  often extending liability coverage homeowner policy save money  company often give discount loss prevention  common central station monitored alarm system  company rarely generous alarm sale people indicate  saving simply providing certificate installation  sometimes homeowner policy modified substantial rehabilitation done home  would need talk agent  could also discus jewelry insurance jewelry often located safe deposit bank 
college major study order insurance agent ,life tpd insurance stand life total permanent disability insurance  life insurance policy add would pay lump sum insured person become totally permanently disabled  paid  death benefit usually reduced tpd amount paid 
medicare cover dme supply ,buy life insurance people insurable interest person willing sign application insured  insurable interest mean policy owner beneficiary must stand suffer direct financial loss insured pass  example spouse  business partner childrenparents 
borrow retirement plan pennsylvania ,handful university offer degree insurance  looking professional training law would probably helpful  particularly want involved estate planning commercial insurance  degree marketing would prepare aspect insurance business  actually  insurance agent come wide variety educational background 
cost long term care insurance ,yes  medicare cover dme supply prescribed doctor use home rather health care facility  long term rehab center  etc  addition  durable medicare equipment must long lasting  used medical reason  useful someone sick injured 
much homeowner insurance need connecticut ,pretty difficult question answer forum like  highly recommend speak professionaloneonone completely evaluate need see borrow   would financially smart borrow retirement fund  feel free contact one else  give little idea could however  guideline  retirement fund available borrow  defined benefit cash balance benefit  borrow  move fund different account  professional guidance avoid penalty  type account  usually touch retire  profit sharing account 401k  may able borrow depending upon rule company andor rule company work   however  allow borrow   typically borrow 50  contribution  company contributes   10k  whichever le   difficult technical topic get solid answer  look help 
medicare estate recovery ,cost longterm care insurance based many factor including age  health condition  average cost facility area type coverage want  experienced broker ideal review best plan best price  nt work anyone unlicensed parttime worker  person spends significant amount time medium side business best resource   fulltime broker going provide best information 
company cheapest renter insurance pennsylvania ,talk insurance professional ask insuring value  mean insuring calculated cost reconstruct home event loss  agent able offer comprehensive reconstruction analysis based upon  make proper recomendation amount coverage  established sure reconstruction cost guarantee included policy 
would someone denied life insurance , estate recovery act pertains medicaid recipient age 55 received benefit certain period time  received certain service paid medicaid  nursing home  prescription drug  others   beginning jan  2010  estate recovery allowed medicare saving expense paid state 
fafsa count annuity ,seen esurance tv commercial  websitelink   everybody want cheap insurance almost insurance give cheap insurance  reality get pay  renter insurance probably affordable coverage find probably cost  15 month great coverage  make sure policy replacement cost content includes additional living expense  saving  5 month could wind costing thousand dollar wrong policy  check independent insurance agent look multiple carrier see policy right 
buy health insurance ,numerous reason declined life insurance  think term gambling  placing small bet  monthly premium  order make sure loved one enough money live current mean  large payoff death  therefore underwriter look factor determine risk dying within specified period time  look age  build  medical history  health  lifestyle  residence  occupation  etc  determine risk  feel factor risky declined life insurance 
