question,answer
need homeowner insurance ,question little vague  asking need get price homeowner insurance  need several piece information  need know year home built  square footage home  physical characteristic home personal information  asking coverage  call local agent help decide policy endorsement right 
life insurance forbidden islam ,many scholar find insurance unfair  since nt guaranteed return appearance gambling  living nonislamic country  abiding local law permissable  muslimmajority country alternative company formed called takaful provide similar coverage sharedrisk model 
purpose whole life insurance ,purpose whole life insurance provide guarantee  know  good job  guarantee godsend financial world cycle ups down cost increase norm  nice product truly count  guarantee come three delicious flavor  flavor number one  guaranteed premium  get older  price stay  cost company insure  price stay  company bad investment year  two  three  price stay  thats good  there  flavor number two  guaranteed death benefit  see variable mentioned number one could affect price dont  could also affect death benefit  dont  neither age  increasing cost  poor investment performance reduce benefit leaving heir  really good  one last delicious flavor  flavor number three  guaranteed cash accumulation  favor compare guaranteed growth cash inside good whole life contract socalled guaranteed investment  notice whole life basically beat pant competition regard  course  always wise taking money life insurance  make sure dont reduce death benefit undesirable amount  given  whole life make real valuable contribution conservative portion financial portfolio 
get life insurance license alabama ,license another state  apply nonresident license alabama using nipr  national insurance producer registry   starting life insurance career alabama  must study licensing test  pas  pay appropriate fee  use life insurance license alabama benefit life life others 
renter insurance cover animal ,two part answer two coverage tenant policy  animal normally covered personal property  pet dy house fire  probably isnt recovery  however  animal hurt someone household member  might coverage legally liable pay damage  however  carefully check policy many exclude various breed animal many also limit amount liability coverage event animal related incident 
single person dependent need life insurance ,single person debt financial obligation someone pay die  leave load debt loved pay  better die dignity  get life insurance  expect remain disposed life insurance 
best term life insurance company ,far competitive premium  prefer federal life  banner trans america   every client s situation may differ need  current health  past health budgeted allowance protection  product used mortgage protection  income replacement consumer debt  dependent child  many factor providing right plan right situation 
homeowner insurance binder ,binder one page summary showing policy issued force  use term policy bound binder come  case new policy issued agent issue binder insured lender showing proof coverage since actual policy deceleration page available several day 
mean deductible health insurance ,think deductible form self insurance  word  portion ll pay insurance begin pay claim  health plan usually offer choice deductible lower premium cost choose higher deductible  higher deductilbe mean accept cost upfront use health plan order receive lower premium cost  deductible met  usually go phase called  coinsurance   coinsurance phase insurance company split bill care  coinsurance level may 5050  6040  7030 combination depending plan  example plan 8020 coinsurance provison  500 deductible bill  2500 service  would split follows  first  500 bill  remaining  2000  insurance company pay  1600 towards bill additional  400  please note  ve met deductible year  longer charged claim  coinsurance would next  ve met coinsurance limit  claim balance year  counting copays  covered 100  
federal government offer disability insurance ,federal government offer two program social security disability insurance  ssdi  payroll deducted  classified earned benefit supplemental security income  ssi  mean tested income asset 
medicare pay abdominoplasty ,medicare pay medically necessary treatment  surgery  procedure  medication  medicare cover surgery cosmetic purpose  abdominoplasty medically necessary correct related heath condition  therefore  covered medicare  medicare advantage plan may cover drug related abdominoplasty done 
auto insurance coverage right ,order determine right coverage fit need really need sit local agent consult rightcoverage s  without giving u specific trying protect impossible advise 
viatical life insurance ,viatical concept buying life insurance policy terminally ill market grew aid epidemic 1980s  policyowner transfer ownership policy entity pay cash policy  cash often useful help medical bill large end life care  value policy likely greater cash surrender value le death benefit  entity make profit difference sale price death benefit collect insured dy  viatical market evolved called life settlement policy sold longer involving terminally ill also include senior unwanted life insurance policy desire get something cash surrender value  financial crisis miscalculation life expectancy within life settlement business caused investor frenzy time cool sharply several year ago making transaction le popular today though still viable idea condition 
cash universal life insurance policy ,yes  cash universal life policy  discus ramification decision agent  first  cash  roll cash value new permanent policy without paying tax cash  cash  call company issued 
average cost whole life insurance ,premium quote dependent final underwriting outcome based health  gender age proposed insured  here example  rule thumb  participating whole life insurance purchased base policy rider generally 20  guaranteed universal life  gul  counterpart  30 year old male nonsmoking super preferred health covering  100000 gul average around  550 annually top 25 leading life insurance company  average participating whole life policy come around  675 annually  always check rate quoted online life insurance service confirm cost moving forward 
information needed home insurance quote ,great deal public information available internet home location  minimum would need know address property  prepare quote would need know general description home determine pet  trampoline property  would need know woodburning device inside home  would need know claim past three year property proposed insured  quote could give would guaranteed price done full underwriting take place usually quite close 
group universal life insurance policy ,group universal life similar individual universal life  group policy involve plan sponsor  often employer  holding master policy individual participant receive certificate insurance  convenient voluntary way acquire cash value life insurance workplace  usually employee pay premium case benefit would immediately fully vested  employment termination portability feature product generally allow coverage taken participant individual policy 
much life insurance ,many people choose purchase life insurance amount 10 time annual salary  people add important thing life would threatened pas  eg  possible loss home  child unable attend college choice  purchase policy would replace fund needed thing  purchasing policy specific purpose  funeral pay inheritance tax estate  purchase policy anticipated amount  amount life insurance varies person  visiting good life insurance agent help make determination 
look buying life insurance ,clientspecific driven question  good one  depends client s age  health  income  etc  looking carrier  would look carrier strong history creditworthiness life insurance business rate well standard  poor s rating 
state farm renter insurance cover theft ,whetherit state farm another insurance carrier purchased property protection renter policy would covered theft yourpremisesminus deductible  contact local agent discus potential theft loss  also good time review policy make sure youcoveragesare adequate ever changing need 
renter insurance cover garage item ,renter insurance cover property  item garage would covered peril covered policy  store valuable item garage  usually much easier break garage home 
need earthquake insurance home ,lot depends area live  generally  unless somewhere like california  earthquake coverage inexpensive bad idea add already included  company may require  ohio live example  know s earthquake however relatively minor one caused damage  unless area chance earthquake would recommend 
qualifies life insurance ,life insurance statistic company provide life insurance individual wide range health  obtain coverage longevity immediate risk  however  many consider uninsurable actually obtain coverage  life expectancy long  premium coverage going quite high 
renter insurance cover fire ,fire homeowner insurance pay damage personal property  additional cost finding alternate temporary lodging adjust claim basis replacement cost selected coverage  liability claim arising fire liability section defend pay award limit policy 
protected renter insurance ,renter policy cover damage personal property located residence  would include clothing  furniture thing  coverage specified limit  policy also cover sued occurrence qualifies coverage  suit must seeking damage bodily injury property damage must excluded provision policy  coverage specified limit 
much cost car insurance ,car insurance rate based several variable different everyone  start  age  driving history  car driving much coverage want vs need  company look credit score well  wish could tell exact number however see  range could inexpensive pretty costly  always shop around talking agent see offered 
life insurance contested ,life insurance contested  rare succeed  beneficiary chosen owner life insurance policy wanted money go  policy legal contract  important keep beneficiary date death benefit go person   choice 
nursing home care covered medicare ,nursing home care covered medicare circumstance  1 must stay medicare certified skilled nursing facility  2 must enter nursing home qualified inpatient hospital stay least three consecutive day  starting day enter hospital  counting day leave   3 must enter snf  skilled nursing facility  within 30 day  4 doctor must ordered snf stay due need custodial care daily basis  snf care must something treated qualifying hospital stay  5 medicare part pay 100 day nursing home coverage 
life insurance quote ,great question  insurance lingo confusing  especially shopping trying compare price  word cause confusion  u agent usually mean  1 quote  price think get based told u  looking medically underwritten policy asked many health detail  chance quote accurate  also tell someone following script  many nuance person s situation  find agent quote experience knowledge   b   opinion get accurate quote end better rate  2 rate  price actually end paying  another word premium  cost underwriting done final rate determined insurance company  3 rating  refers health rating  example preferred  standard  table c rated underwriter review health information  hope help  feel free contact post question might 
someone eligible medicare part ,order qualify part applicant covered part part b coverage live county designated plan  someone medicare card show eligible part part b 1112013 qualfied buy part plan
use health insurance another state ,use health insurance another state  depends whether considered network  emergency  company willtreat network claim  random md visit  likely treated outofnetwork
rollover 401k ,reason many people rollover 401 k plan generally better control account leaving company  also better control rather contact old imployer  may get getter return 40l k different investment firm 
need license sell life insurance maine ,peggy 100  correct  course d like give tip get life health license  population maine pretty sparse new field may want expand portfolio product instead concentrating specific type insurance 
much disability insurance doctor ,disability insurance policy priced based several factor applicant  include age  gender  occupation duty occupation  tobacco use  amount coverage needed desired  amount coverage often dictated person s earned income  someone earns  coverage available  several policy design feature included plan   also affect price  person s medical history also play important role pricing  see  lot moving part disability policy affect price  doctor often buy coverage protect specific medical specialty  best discus important insurance coverage knowledgeable professional 
tricare primary medicare ,tricare never primary medicare  pay insurance paid  tricare entitled part  must part b continue tricare pharmacy benefit  however enroll part prescription plan  choose enroll part plan  tricare secondary plan well 
hsa health insurance plan ,hsa health saving account  employer offer benefit  take advantage  allows available medically related need  set limit pretaxed money typicallyset aside payroll deduction  medical need hsa fund usually available  doctor  visit  physicals  surgery  eyeglasses  prescription  etc 
age limit health insurance ,age remember health insurance 26 affordable care act  child stay parentguardians health insurance age 26 regardless marriage status enrollment school  age 26  person must obtain insurance  age 30 obtain catastrophic insurance coverage lower premium acacompliant policy  catastrophic plan  preventive care covered  individual responsible 100  cost outofpocket maximum   6350 individual 
find registered investment advisor ,generally speaking registered representative restricted advertising  firm known handle security probably one registered representative  life insurance agent also registered representative  organization deal mutual fund would registered representative well 
cash life insurance policy ,owner life insurance policy cash  course mean surrender  terminate coverage  leaf life insurance  far better thing would borrow  whole life insurance  never term  whish surrender cash value  instead borrow  policy stay force  diminished death benefit  always repay loan return full death benefit  grown  since grows even loan taken place  due accumulation  get major part death benefit however repay loan emergency past  talk experienced agent  gary lane  registered representative agent  new york life  949 797 2424 thank 
one person two life insurance policy ,yes  one person two life insurance policy  many people buy variety policy different type product best meet different type need  simply want diversify company life insurance  insurance company mind many policy  long qualify financially 
medicare premium 2014 ,one know yet  medicare premium part b 2013 projection average premium medicare part 2014  31month   1month higher averaged past three year  medicare part b premium 2013  10490month modest income 
start long term care insurance ,conventional wisdom later age 50 potential morbidity event begin increase age 62 price consideration  establishing long term care insurance policy part defensive retirement planning high priority based life expectancy average cost fo extended care senior year 
qualify medicare wyoming ,qualify medicare wyoming  must age 65 paid social security tax 40 quarter  10 year  working life  must havehad spouse  age 65  get medicare receiving social security disability benefit two year  end stage renal disease  al  specific guideline  see medicaregov detail 
get disability insurance ,ideal person need disability insurance person s valuable asset ability earn living  someone need steady paycheck order pay normal living expense  prime candidate disability insurance  8 time likely become disabled injury illness die 
cheapest renter insurance ,enough information answer question certainty  rate renter insurance vary greatly carrier carrier area area  many factor go determining rate pay coverage seeking  find best rate coverage seeking within area would suggest calling local agent find availability coverage pricing 
life insurance go trust ,yes  trust advantageous depending reason trust type trust  example  use funeral trust way prefund funeral protect life insurance medicaid spend  experienced agent look individual situation help determine trust would benefit 
penalty health insurance obamacare ,penalty people afford health care health insurance affordable healthcare act fee  fee called  individual mandate   individual responsibility payment   assessed one two way  first 1  yearly household income maximum penalty cost bronze plan  second way  95 per person family half   4750 per child  maximum penalty  285 family  fee collected 2014 household income completed 2015 income tax form  wage low person family may entitled waiver  fee increase every year next increase 2015 25  yearly household annual income  695 per adult 
get quote homeowner insurance ,could call insurance agent within area start  whe call please following information available  normally requires year construction home  square footage home  type garage    deck porch  basement type    architecture type home  distance nearest responding fire department  possibly 
life insurance taxed paid , life insurance taxed paid  case  exception  beneficiary estate  life insurance benefit subjected tax rest estate  eligible virtue amount  life insurance subject estate tax  large  however  life insurance taxed paid  making favorable gift receive 
much full coverage auto insurance california ,full coverage always dangerous term  people consider full coverage comprehensive collision coverage s vehicle  however would leave medical  rental reimbursement  towing possible option  said coverage actually full  question blanket question actually impossible answer without series question asked first location  age operator  marital status  driving history driving record mention type car  highly suggest contact local agent quote multiple company find best coverage s rate fit need 
apply medicare part b online ,apply online medicare part b accomplish different way  go directly social security website complete short online paperwork  also go  person  social security office area  typically  far away  also call  800  7721213 course  working experienced broker help reputable website also make process much easier  nt worry  broker nt charge fee 
much annuity ,product suitability dictate whether purchase nonqualified annuity  first need establish personal financial profile includes risk tolerance assessment  defined financial goal  estimate life expectancy determination effective tax bracket  assist product suitability selfexamination 
car insurance go credit report ,hope understand question correctly  m assuming re asking insurance company getting insurance score show credit report affect credit score  general   speak state michigan m pretty sure state work way  insurance score different credit score  many different model calculate insurance score different company use different model  insurance company order insurance score wo nt affect credit score like applying loan  show  show insurance score wo nt used calculate credit score   nt worried agent asks information order insurance score  s usually one largest discount company offer 
moving across country  option insure property transit,homerownersrentercondo policy force time property transit  could coverage extended policy  carrier represent  cover 10  content limit  premisis   mean policy  100000 content coverage  could  10000 coverage situation like  one carrier provides 100  policy content limit anywhere world  ifthere policy force property transit  check moving company see option available  policy specific language property  offpremisis  definately call local independent agent ask specific amount policy provides situation descirbed 
pcn stand health insurance card ,pcn stand processor control number  short  one identifcation code related prescription drug plan pharmacy need determine prescription covered drug plan would paid  covered  hope information helpful  please feel free contact assistance coverage question  thanks much 
much long term care insurance enough ,every financial product purchase value proposition  including long term care  based present gerontology statistic ever increasing life expectancy  youll want secure maximum coverage longest period  keep mind includes convention nursing home confinement parent knew well today popular assisted home living 
look buying renter insurance ,first look competent agent  get referral reliable friend  friend experienced loss frequently informed  setting coverage limit critical determine company protects event loss  make sure agent provides accurate information company  make sure comfortable agent office staff 
much health insurance job ,point time within united state cost health insurance coverage purchased thru employer vary greatly depending carrier  coveragesprovided  number people enrolled plan  health history participant  many employer demand carrier work allow thier employee one option come plan offered 
much individual health insurance new jersey ,varies person person  age  live  use tobacco product  qualify subsidy reduce premium determine much good policy going cost  affordable care act  option bronze  silver  gold  platinum level plan  go metal  price go  provides better benefit   area also catastrophic plan available  addition  age big factor well  younger  cheaper premium  older  higher premium  also  use tobacco product  premium increased 50  well  plan offer good coverage  silver gold plan middle road type plan provide strong coverage affordable price  always recommend consulting experienced health insurance broker apply anything  help determine plan s going suitable need budget  hope information helpful  please feel free contact help question  thanks much 
homeowner insurance cover lost wedding ring ,ring  scheduled  specifically coverage rider homeowner  policy  homeowner cover belonging specific peril  listed contract  item  lost   mysteriously dissappears   unfortunately covered peril homeowner policy  ring scheduled rider insured separately s policy  lost ring s replacement would covered 
life insurance require blood test ,depends amount applied applicant s age  older applicant  smaller amount applied trigger requirement blood profile  along blood draw  urine specimen may part underwriting requirement  insurance company usually pay test 
car insurance cover driver car ,rule thumb auto insurance  follows driver first vehicle second  driving vehicle auto insurance typically provide coverage accident first claim exceeds coverage claim could also charged vehicle owner auto insurance coverage 
purchase medicare insurance ,broker  d say best way buy medicare using broker  actually  ll get part  b government  drug coverage well supplemental coverage purchased separately  suggest using broker purchase type insurance reason  insurance quite involved  lot moving part  learn 100  medicare  probably 2  relates  98  exception situation nt relate  broker ask question deal 2  relates 
long child parent health insurance ,child parent  health insurance plan 26 year old  however  may cost effective certain point go individual plan group plan employer employed  consult experienced health insurance broker regarding family s insurance plan benefit cost determine suitable program family s specific need  hope information helpful  please feel free contact help question  thanks much 
secure horizon medicare supplement ,secure horizon senior market insurance carrier  offier medicare advantage medicare supplement choose suit best  know medicare rank carrier plan star system  using tool let know beneficiary medical professional like plan  5 star best   never seen one   nt afraid three star plan  three half better recommend find medicare adviser town let work charge  hope response helpful
much renter insurance cost month ,looking cheap renter insurance  renter insurance inexpensive  best way purchase renter insurance online request lowest personal property  content  coverage needed  minimum personal liability coverage needed highest deductible afford  provide cheapest quote  link providing online format obtain quote buy renter insurance online multiple state  may useddirectly consumer  great way buy renter insurance online  websitelink
medicare part b plan best ,government originally established medicare two part  part cover hospital part b cover outpatient service  administered medicare  cm  choice coverage  later part initiated cover prescription  plan called pdp s administered private insurance company  part c  medicare advantage plan plan administered private insurance company instead medicare  far plan best  depend individual situation  live  doctor hospital go  travel outside area lot  prescription  factor  find good independent agent represents medicare plan area agent help choice  also find information medicaregov 
many employer offer disability insurance ,employer offer company sponsored group benefit plan odds short term disability coverage  check human resource department confirm  majority business offer individual disability insurance rank file employee  thats generally reserved recruiting retaining key employee 
