question,answer
much car insurance ny ,car insurance rate new york determined many variable  important factor driving record  including family member   zip code county  age  type vehicle drive  credit history  vehicle used type coverage carry  additionally  company insured play big role determining rate   get free quote car insurance new york  reputable nationwide  new york based  car insurance website zoom  pun intended  destination  typically  compare best offer get expert advice cost 
retirement plan ,retirement planning paying  disciplined despot retirement plan every paycheck  matter small help develop habit ll appreciate retire  need look baby boomer generation funded retirement account give glimpse future  save today determine lifestyle retirement 
short term disability insurance cover maternity ,order disability insurance policy pay time work due maternity childbirth  must short term disability policy  term policy depend short term disability policy choose  keep mind purchase type coverage becoming pregnant 
health insurance end leaving job ,leave job terminated health insurance usually end end month left job  time would eligible cobra continuation coverage 18 month could purchase indivdiual health insurance  cobra used best option preexisitng condition affordable care act  commonly known obamacare  purchase individual coverage issue  prove qualifying event irs code letter creditable coverage former health insurance company employer 
life insurance get taxed payout ,death benefit life insurance usually paid tax free paid directly beneficiary    go estate  human beneficiary named  usually taxed  planning larger estate  want involve estate planning attorney  life insurance agent cpa advisory team  certain situation may taxed plan well  big advantage wholelife insurance also use tax free income die  life insurance one tax favorable money management tool available 
cheapest car insurance new driver ,cheapest car insurance driver policy force pay claim accident occurs  regardless premium  california inexperienced driver assigned one car household  make premium vehicle increase substantially  avoid temptation eliminate reduce coverage lower premium  could make auto insurance expensive pay claim make whole 
medigap pay ,medigap  also known medicare supplement insurance  cover portion balance approved medicare part part b expense  medigap plan standardized assigned letter  medigap plan letter identical every way  except premium  medigap plan f pay 100  balance approved medicare part part b expense 
men s car insurance higher ,insurance company base pricing mound historical data  carefully review statistic common industry well specific company s loss experience  risk analysis ultimately result rate pay product company offer  great many year  statistic tended show younger le experienced male driver tend involved claim young  le experienced female counterpart  case  thing equal  would cost male insure car would female insure car 
rent car enterprise without insurance ,insurance policy protect rent car option purchase insurance provided rental car company  must one rental car company let take vehicle road without insurance  keep mind insurance provided rental car company generally state minimumcoverage s 
car insurance company drop ,yes  pay premium longer meet carrier standard carrier either cancel nonrenew policy typically least fourteen day notice  contact local agent discus detail drop notice  may able help understand reason behind coverage dropped nonrenewed 
long term health insurance ,going take stab quite sure question  health insurance necessarily long term unless long time however may switch different plan  asking longterm care insurance also answer  longterm care provides benefit chronic illness need  pay nursing home  care program  assisted living situation  inhome support 
homeowner insurance increasing ,great question  unfortunately  probably  price homeowner depends part upon cost building repairing home near  construction cost rise  premium  price also rise number claim filed near  company trying recapture lost profit  best bet contact local agent help compare price  see one might affordable  always gamble raise deductible also  thank asking 
retirement plan fiduciary ,employee retirement income security act  erisa  1974 requires employer sponsored plan accept fiduciary responsibility compliance 404c newest regulation fee disclosure  408  b   2   erisa requires employer design written plan  trust fund hold asset  accounting system retirement plan written notification update plan participant 
withdraw cash value life insurance policy ,first sure cash value life insurance policy  example whole life  universal life  indexed universal life variable life  term life cash value  locate policy illustration page  depending year accumulation see cash value policy  may  borrow  cash value low interest rate keep coverage force  may cancel coverage receive full cash value amount income tax free case  simply  call insurance company ask proper form sent order execute transaction  however  later  sure alternative coverage place unless fortunate enough need life insurance future 
retirement survivor disability insurance ,retirement  survivor  disability insurance reference three benefit social security pay paid social security tax   retirement  part refers social security income people get retire   survivor  part refers social security income benefit paid dependent qualified deceased person   disability  part refers social security disability benefit disabled person receive qualified 
exclusion ratio annuity ,exclusion ratio usually refers taxation payment proceeds  take paid  divided paid  come percentage ratio  ratio applied fund paid portion fund would excluded  taxation  consult tax professional see may apply individual situation 
disability insurance mean ,disability insurance  cover unable perform job due accident illness  company consider disability include  occupation  others consider disability mean unable perform duty occupation  selecting disability plan make sure choose  occupation   occupation  
annuity rolled 401k ,youre addressing existing nonqualified annuity desire use funding 401  k   following caution advised  name may annuity well ira  reality  changing ownership registration  happens annuity  effect  surrendered surrender trigger ordinary income tax event gain policy  youre age 59 additional 10  penalty assessed well  dont forget nonqualified annuity basis tax free  inserting ira  give tax free status basis ira distribution ordinary income tax event  moving forward change consult tax advisor cpa 
claim breast reduction medicare ,answer question going depend  cosmetic surgery  medically necessary  medicare health insurance policy strict regulation paying  cosmetic surgery  happens complication suregery  would recommend rule  cosmetic surgery  invasion made expose possiblities infection complication  go websitelink type procedure inquiry window see medicare say
homeowner insurance cover leaky roof ,damage caused result leaky roof probably covered  damage roof would covered caused named peril  roof leak covered covered depreciated item insurance company  rather replacement  important stop leak quickly possible regardless whether coverage  damage house water quite severe 
medicare cover blood test ,medicare part b cover lab test long medically necessary  routine blood work conjunction annual preventive care exam usually covered charge  lab test diagnostic nature  considered medically necessary  covered subject deductible coinsurance 
life insurance company access medical record ,yes  life insurance company access medical record permission  depending size policy company requirement  medical record may may required policy  apply life insurance  hipaa  health insurance portability accountability act   provides permission insurance company obtain view medical record  medical record  along prescription check  mvr record  exam used determine eligibility life insurance 
much term life insurance 20 year ,s many factor go premium life insurance say policy cost  different every person specific need  premium policy depend insured s age  amount coverage want  long want coverage  case  20 year term insurance   riskclassification  determined medical history   whether theyreapplying full underwriting nonmedical term coverage  risk classification critical factor determining cost  premium  life insurance policy  risk class depends ona number factor including whether re male female  medical history  heightweight profile  tobacco usage  factor  please keep mind  every carrier set underwriting guideline mortality table  may offer different risk class given medical profile  eg  company may offer preferred  featuring lower rate  company b may offer standard  featuring higher rate   nonmedical term life insurance policy almost always cost much fully underwritten policy require exam insurance company taking risk without full medical picture  consult experienced life insurance broker determine coverage appropriatesuitable need budget  please feel free contact help question  thanks much 
term life insurance ,actually buy term life insurance  get pick term  one year  five year  ten year  even twenty year  need pay premium every year  end  97  folk continue pay end  get another policy  find cost older  even available health  man 30 s put buying last week  find developed m pay much higher premium  lucky able get insurance  put buying insurance  something always better nothing  getting permanent whole life insurance safest  rate never go keep entire life  long premium paid  quality agent help determine afford  arrange variety possible alternative option  gary lane  agent new york life  949 797 2424 thank 
annual premium home insurance ,great question  asking  cost  homeowner s policy  may help  home policy rated based age home  type construction  occupancy location  state  florida  distance water important well type roof  two style  gabled roof  popular northern state  hip roof  newer style better resistance wind   hurricane  
kind life insurance buy ,many choice life insurance available  main stream life insurance product term life  universal life  variable life whole life  one specific purpose  term life insurance meant coverage specific period time  common term 15101520253035 year  mean rate premium purchase guaranteed level period time regardless change health  life style occupation  term life commonly used younger people starting life  covering large debt  life mortgage home business debt  covering young child s education  term life insurance allows largest face amount smallest premium payment  universal life variable life permanent life insurance solution build cash value  typically premium expensive face amount le part premium going cash value fund invested numerous option  cash value later used retirement  college fund  critical chronic illness even purchase large asset like home  universal variable option typically aggressive cash value fund  last option  whole life insurance  similar previous universal life insurance option  however  cash value fund typically fixed percentage growth  whole life s name suggests primarily meant cover entire life  recommend using experienced independent life insurance broker numerous carrier shop market find best product best price unique situation  good luck 
xarelto covered medicare ,case  medicare cover medication unless hospitalized  coverage outpatient medical need  would need purchase part prescription drug plan  company offering type coverage  unique formulary list medication consider covered expense  always best consult independent agent represents many different company assist finding absolute best coverage personal situation 
fired health insurance stop ,depends  case coverage stop last day actively work  case  coverage continues end month may continue end following month  case eligible cobra continue 18 month 
split dollar life insurance work ,split dollar arrangement vary corporation s key executive  grantor estate s associated irrecoverable life insurance trust two party share insurable interest  sharing arrangement two entity death benefit cash value life insurance policy 
ok cancel life insurance ,truly policy owner  purchasing new policy providing coverage need better current policy may  case though depending amount time life insurance policy effect  recommended cancel life insurance policy unless absolutely necessary  licensed agent ethically obligated provide information help proposed client make decision best interest agent 
beneficiary life insurance ,depends reason policy  people select spouse  parent family member  policy final expense name person handling affair even funeral home  recommend naming child beneficiary unless money earmarked child turn 18 money left child held trust child legal age 
dropped group health insurance ,yes  someone front office feel like picking day  would change eligibility status company s policy trigger event  example  working hour reduced 30 hour per week put employer s federal government s definition fulltime eligible employee  30 hour per week defines person fulltime benefit eligibility obamacare   could trigger still employee longer eligible group health insurance plan  responsible paying portion health insurance premium  employee day  reason unable pay share premium  usually hard since payment generally taken payroll deduction basis  could terminated nonpayment premium  course  employer decides terminate group health insurance plan entirely dropped coverage group plan longer exists workplace obviously dropped  though usually even small employer try give advance notice employer  especially larger one  required give certain amount advance notice plan change termination  ca nt dropped employer s coverage arbitrary manner still employee meeting eligibility requirement set forth employer s personnel policy state federal law  example  could nt terminated health insurance plan simply running lot expense cancer treatment 
life insurance cover cancer ,life insurance pay death benefit regardless cause death  including cancer  policy include acceleratd death benefit allows access portion death proceeds terminal condition  case death must expected occur withing 2 year taking  loan  
supplemental long term disability insurance ,supplemental disability insurance personally owned long term disability policy usually purchased supplement group employer sponsored long term disability plan  basically  supplementing  existing group plan personally owned policy  reason necessary group plan cover 50 60  employee income  supplemental policy provide additional coverage addition group plan  amount supplemental disability coverage purchase limited based insurance carrier guideline  determined amount income group plan cover weather pay group plan company  general rule  carrier wo nt let insure 70  gross annual income 
married child stay parent auto insurance ,generally married child parent policy  happens try hide  material fact  accident need file claim  usually  parent  policy parent  primary  driver child drive parent car sporadically  spouse vehicle car financed name parent notecan say red flag 
claim medicare private health ,medicare private health insurance  depending type insurance  medicare cancer plan  hospital indemnity plan  ancillary form coverage  medicare employer group health insurance  retiree group health  consult adviser 
life insurance annuity ,annuity issued life insurance company income life  said  numerous way income taken  example  immediate annuity name implies start fund deposited insurance company  deferred annuity start future date  say retirement example  annuity also designed last one annuitant s lifetime fixed amount  guaranteed number year  option available  learn s best  speak independent agent familiar many carrier choice 
expect pay disability insurance ,disability premium pricing depends medical information  behavior compensation  medical information collected gender  age  smoking status  health history  current medical condition  etc  behavior like dangerous recreational activity  hazardous vocation motor vehicle violation  much compensation want coverage within limit disability insurance  generally rule thumb nonsmoking healthy person covering 60  compensation 3 5  compensation coverage 
mutual whole life insurance ,mutual life insurance company owned policy holder select board director  generally proxy vote operate company behalf  every year board director generally declares dividend turn distributed pro rata policy holder 
pension plan sponsor ,example  erisa  employee retirement income security account  1974  employer sponsored defined benefit andor contribution  usually outsource money management third party  employer sponsor also match portion employee s annual contribution  re also responsible compliance qualified plan regulation 
state state disability insurance ,state either mandate carry state disability insurance new york  rhode island  california  new jersey  hawaii  commonwealth puerto rico   california directly offer purchase disability insurance state  sdi tax charged employee fund 
covered long term disability insurance ,short answer covered long term disability insurance percentage income  benefit money used anything choose  typically used cover daily living expense work  used item covered health insurance wheel chair ramp 
switch home insurance ,great question  normal switch home insurance get better rate coverage another insurance company  must inform mortgage mortgage property  make sure new policy cover important thing home 
buy long term care insurance ,good idea buy long term care insurance broker carry multiple company  agency us ltci broker  like   way sure getting competitive rate  expertise agent know qualify  also guide important feature  get one need overspend option add much value 
medicare cover zostavax ,zostavax shingle prevention vaccine  medicare part b cover zostavax vaccine  medicare part plan cover vaccine  amount pay depends plan  usually cheaper go pharmacy injection injection doctor s office 
aflac cancer insurance worth ,matter aflac company  opinion cancer insurance good buy  even person health insurance  cost cancer devastate person financial well  deductible  copay s  travel  loss income  cost alternative treatment  cancer insurance make difference getting better care going bankrupt 
switch car insurance mid policy ,insurance policy cancelled  many company charge number day covered  use another system penalizes bit cancelling end term  need notify company agent  coverage cease  done unless longer vehicle  immediately placing insurance coverage another company 
claim denied due criminal record  right ,required accept decision claim adjuster  company pay fraud involved  normally  would go beyond suspicion implication  many company separate unit investigate fraud  company often refer file criminal prosecutor 
life insurance go w2 ,according wwwirsgov   50000 le groupterm life insurance carried directly indirectly employer  meaning employer pay life insurance employee arranges premium paid least one employee subsidize premium least one employee   tax consequence  life insurance coverage  50000 carried directly indirectly employer  include w2 amount premium taxable employee  policy carried directly indirectly employer tax consequence employee 
nursing home take life insurance ,going medicaid spend  nursing home take cash value life insurance policy amount leave allowable amount asset  right purchase final expense policy burial policy  may possible life insurance policy designated permitted final expense policy 
life insurance proceeds taxed ,case  life insurance proceeds  death benefit  received income tax free beneficiary case  key feature life insurance  common exception include businessowned life insurance issued  materially modified  august 17  2006 may taxable unless specific step taken time application annually thereafter meet condition allow proceeds income taxfree  another exception tax trap life insurance contract three party involved may also unexpected taxable implication 
accidental life insurance worth ,accidental death dismemberment  ad   accidental death benefit  adb   either stand alone policy rider life insurance policy  inexpensive question value  instance  may make sense buyer  nt follow industry sale data granular level safely say neither offered sold much past economy industrial agrarian service oriented way today 
health insurance cover tummy tuck ,tummy tuck covered health insurance plan long considered  coded  medically necessary attending physician  often time considered elective procedure wo nt covered  s vital contact carrier prior procedure find   cover surgery  best place start call benefit verification precertification phone number back insurance card 
health insurance typically cover otoplasty ,health insurance may cover otoplasty  although case  considered cosmetic  usually   may paid covered typical policy  however  plan different always check carrier inquire benefit  cosmetic reason  help chance 
life insurance part estate death ,many varying circumstance lifeinsuranceproceeds  life insurance paid directly benefactress life insurance policy  generally married couple use marital deduction act pas proceeds asset surviving spouse  proceeds remain surviving spouse  subject federal state estate taxation proceeds asset exceed federal unified credit state exemptionsif possibility exists  policy policy owned day one irrecoverable life insurance trust avoid inclusion estate 
get long term care insurance ,time get di different everyone depending occupation health  best answer  soon possible  di cheaper younger  plus never know might become sick injured  re worried might make money future  add rider policy make eligible coverage later date  simply try buy di time come  assuming nt serious medical issue time come  
know health insurance ,policy provides health plan information  ll tell carrier name  policy number  plan detail including premium  copayments  coinsurance  deductible  maximum outofpocket expense  re unsure exactly  always contact health insurance agent get information  re looking new coverage  always recommend consulting experienced broker make sure provides good coverage meet need budget  experienced broker indepth knowledge product multiple carrier  review wide range option  help determine program best serve need  please let know assistance  thanks much 
average salary life insurance agent ,s great question  insurance agent often work payment made sell policy product company  called commission  commission fairly sizable  small  depending upon sale  therefore  case  earnings insurance agent depend entirely upon ability sell  product commission paid upon sale  believe vast majority agent tailor right product need client  unfortunately always interested commission client  always wise idea want  feel pressured  ask time think  follow instinct  considering career agent  aware start period really lean ve gotten client base built  may need another source income  especially accustomed steady paycheck  get rolling  motivated  honest  good client  make comfortable living  anything help  m happy  feel free contact  thanks asking 
invented critical illness insurance ,critical illness insurance cover specified major illness  typically  pay lump sum  sometimes different  payment insured  first critical illness policy issued 1983 south africa  grown popularity since time  fulltime broker  parttimer  medium person someone fullylicensed  best resource quote information 
great clip offer health insurance ,since location franchised  would depend franchise owner  typically  coverage offered  may paid full owner  importantly  get good haircut great clip  s opinion  answer would yes 
krystexxa covered medicare ,krystexxa medication used treat gout effective treatment produced desired result  fda approval krystexxa granted 2010 2011 medicare assigned treatment code krystexxa  krystexxa infusion therapy  covered medicare part b due cost   60000 per year  may limit placed many treatment approved medicare 
right amount homeowner insurance ,talk tot insurance professional ask current  reconstruction analysis  home  sure detail improvement renovation may made properly factored calculation  result analysis  completed properly  accurate measure would cost reconstruct home today  severely damaged lost due covered peril  figure determined  sure ask policy includes form  replacement guarantee  make sure moving forward remain properly covered 
much car insurance 17 year old female california ,california sex driver play role price car insurance  year make model car important  annual mileage vehicle  driving record every driver household important year experience driver also important  factor illustrate rating complex meet trusted insurance agent guide process 
medicare cover xanax ,xanax prescription drug used often treat anxiety  medicare part cover least portion cost xanax  evaluating prescription drug plan  including coupled medicare advantage plan  make sure run medication medicare drug formulary finder 
much life insurance usually cost ,many factor pricing lifeinsurance  s impossible estimate cost  much need  long need  gender  smoker  healthy  family health historygood  dangerous recreational activity  motor vehicle record clean  substance abuse problem drug oralcohol  felony  credit good  name factor enter price tag lifeinsurance 
buy life insurance young ,life insurance always cheapest  exception would smoker quits  applies year later  course going without insurance year carry risk dying time without providing yourfinal expense  thefinancial need loved one  
